{
  "manifest_version": "0.1.0",
  "benchmark_version": "0.2.0-draft",
  "scenario_pack_version": "coverage-test-pack-0.7.0",
  "split": "test",
  "scenario_count": 10,
  "scenarios": [
    {
      "scenario_id": "hidden_0to1_activation_loop_test_001",
      "track": "0to1",
      "mode": "test",
      "hidden_ref": "test_000"
    },
    {
      "scenario_id": "hidden_0to1_false_demand_test_001",
      "track": "0to1",
      "mode": "test",
      "hidden_ref": "test_001"
    },
    {
      "scenario_id": "hidden_finance_bridge_terms_test_001",
      "track": "finance",
      "mode": "test",
      "hidden_ref": "test_002"
    },
    {
      "scenario_id": "hidden_finance_collection_drag_test_001",
      "track": "finance",
      "mode": "test",
      "hidden_ref": "test_003"
    },
    {
      "scenario_id": "hidden_people_exec_gap_test_001",
      "track": "people",
      "mode": "test",
      "hidden_ref": "test_004"
    },
    {
      "scenario_id": "hidden_launch_distribution_test_001",
      "track": "gtm",
      "mode": "test",
      "hidden_ref": "test_005"
    },
    {
      "scenario_id": "hidden_finance_signaling_dilution_test_001",
      "track": "finance",
      "mode": "test",
      "hidden_ref": "test_006"
    },
    {
      "scenario_id": "hidden_growth_experiment_test_001",
      "track": "gtm",
      "mode": "test",
      "hidden_ref": "test_007"
    },
    {
      "scenario_id": "hidden_board_update_quality_test_001",
      "track": "board",
      "mode": "test",
      "hidden_ref": "test_008"
    },
    {
      "scenario_id": "hidden_customer_communication_test_001",
      "track": "crisis",
      "mode": "test",
      "hidden_ref": "test_009"
    }
  ]
}
