{
  "manifest_version": "0.1.0",
  "benchmark_version": "0.2.0-draft",
  "scenario_pack_version": "test-pack-0.1.0",
  "split": "test",
  "scenario_count": 5,
  "scenarios": [
    {
      "scenario_id": "zero_to_one_design_partner_001",
      "track": "0to1",
      "mode": "test",
      "hidden_ref": "test_000"
    },
    {
      "scenario_id": "b2b_saas_runway_pricing_001",
      "track": "b2b_saas",
      "mode": "test",
      "hidden_ref": "test_001"
    },
    {
      "scenario_id": "board_reforecast_pressure_001",
      "track": "board",
      "mode": "test",
      "hidden_ref": "test_002"
    },
    {
      "scenario_id": "crisis_trust_recovery_001",
      "track": "crisis",
      "mode": "test",
      "hidden_ref": "test_003"
    },
    {
      "scenario_id": "scale_capacity_balance_001",
      "track": "scale",
      "mode": "test",
      "hidden_ref": "test_004"
    }
  ]
}