{
  "manifest_version": "0.1.0",
  "benchmark_version": "0.2.0-draft",
  "scenario_pack_version": "real-world-test-pack-0.4.0",
  "split": "test",
  "scenario_count": 10,
  "scenarios": [
    {
      "scenario_id": "real_world_airbnb_emergency_financing_test_001",
      "track": "board",
      "mode": "test",
      "hidden_ref": "test_000"
    },
    {
      "scenario_id": "real_world_brex_svb_treasury_shock_test_001",
      "track": "crisis",
      "mode": "test",
      "hidden_ref": "test_001"
    },
    {
      "scenario_id": "real_world_buffer_runway_crunch_test_001",
      "track": "finance",
      "mode": "test",
      "hidden_ref": "test_002"
    },
    {
      "scenario_id": "real_world_dropbox_phishing_test_001",
      "track": "crisis",
      "mode": "test",
      "hidden_ref": "test_003"
    },
    {
      "scenario_id": "real_world_github_failover_test_001",
      "track": "crisis",
      "mode": "test",
      "hidden_ref": "test_004"
    },
    {
      "scenario_id": "real_world_zoom_security_freeze_test_001",
      "track": "crisis",
      "mode": "test",
      "hidden_ref": "test_005"
    },
    {
      "scenario_id": "real_world_atlassian_restoration_test_001",
      "track": "crisis",
      "mode": "test",
      "hidden_ref": "test_006"
    },
    {
      "scenario_id": "real_world_shopify_peak_readiness_test_001",
      "track": "scale",
      "mode": "test",
      "hidden_ref": "test_007"
    },
    {
      "scenario_id": "real_world_airbnb_demand_shock_test_001",
      "track": "board",
      "mode": "test",
      "hidden_ref": "test_008"
    },
    {
      "scenario_id": "real_world_robinhood_volatility_outage_test_001",
      "track": "crisis",
      "mode": "test",
      "hidden_ref": "test_009"
    }
  ]
}
