{
  "manifest_version": "0.1.0",
  "benchmark_version": "0.2.0-draft",
  "scenario_pack_version": "coverage-fresh-pack-0.4.0",
  "split": "fresh",
  "scenario_count": 7,
  "scenarios": [
    {
      "scenario_id": "hidden_0to1_activation_loop_fresh_001",
      "track": "0to1",
      "mode": "fresh",
      "hidden_ref": "fresh_000"
    },
    {
      "scenario_id": "hidden_0to1_false_demand_fresh_001",
      "track": "0to1",
      "mode": "fresh",
      "hidden_ref": "fresh_001"
    },
    {
      "scenario_id": "hidden_finance_bridge_terms_fresh_001",
      "track": "finance",
      "mode": "fresh",
      "hidden_ref": "fresh_002"
    },
    {
      "scenario_id": "hidden_finance_collection_drag_fresh_001",
      "track": "finance",
      "mode": "fresh",
      "hidden_ref": "fresh_003"
    },
    {
      "scenario_id": "hidden_people_ownership_break_fresh_001",
      "track": "people",
      "mode": "fresh",
      "hidden_ref": "fresh_004"
    },
    {
      "scenario_id": "hidden_launch_distribution_fresh_001",
      "track": "gtm",
      "mode": "fresh",
      "hidden_ref": "fresh_005"
    },
    {
      "scenario_id": "hidden_finance_structured_drag_fresh_001",
      "track": "finance",
      "mode": "fresh",
      "hidden_ref": "fresh_006"
    }
  ]
}
