{
  "manifest_version": "0.1.0",
  "benchmark_version": "0.2.0-draft",
  "scenario_pack_version": "operator-test-pack-0.2.0",
  "split": "test",
  "scenario_count": 5,
  "scenarios": [
    {
      "scenario_id": "hidden_gtm_pipeline_reset_test_001",
      "track": "gtm",
      "mode": "test",
      "hidden_ref": "test_000"
    },
    {
      "scenario_id": "hidden_gtm_enterprise_freeze_test_001",
      "track": "gtm",
      "mode": "test",
      "hidden_ref": "test_001"
    },
    {
      "scenario_id": "hidden_finance_liquidity_test_001",
      "track": "finance",
      "mode": "test",
      "hidden_ref": "test_002"
    },
    {
      "scenario_id": "hidden_finance_margin_shock_test_001",
      "track": "finance",
      "mode": "test",
      "hidden_ref": "test_003"
    },
    {
      "scenario_id": "hidden_people_attrition_test_001",
      "track": "people",
      "mode": "test",
      "hidden_ref": "test_004"
    }
  ]
}
