{
  "manifest_version": "0.1.0",
  "benchmark_version": "0.2.0-draft",
  "scenario_pack_version": "operator-fresh-pack-0.4.0",
  "split": "fresh",
  "scenario_count": 9,
  "scenarios": [
    {
      "scenario_id": "hidden_gtm_pipeline_reset_fresh_001",
      "track": "gtm",
      "mode": "fresh",
      "hidden_ref": "fresh_000"
    },
    {
      "scenario_id": "hidden_gtm_enterprise_freeze_fresh_001",
      "track": "gtm",
      "mode": "fresh",
      "hidden_ref": "fresh_001"
    },
    {
      "scenario_id": "hidden_gtm_reference_decay_fresh_001",
      "track": "gtm",
      "mode": "fresh",
      "hidden_ref": "fresh_002"
    },
    {
      "scenario_id": "hidden_finance_liquidity_fresh_001",
      "track": "finance",
      "mode": "fresh",
      "hidden_ref": "fresh_003"
    },
    {
      "scenario_id": "hidden_finance_margin_shock_fresh_001",
      "track": "finance",
      "mode": "fresh",
      "hidden_ref": "fresh_004"
    },
    {
      "scenario_id": "hidden_finance_covenant_squeeze_fresh_001",
      "track": "finance",
      "mode": "fresh",
      "hidden_ref": "fresh_005"
    },
    {
      "scenario_id": "hidden_people_attrition_fresh_001",
      "track": "people",
      "mode": "fresh",
      "hidden_ref": "fresh_006"
    },
    {
      "scenario_id": "hidden_people_reorg_drag_fresh_001",
      "track": "people",
      "mode": "fresh",
      "hidden_ref": "fresh_007"
    },
    {
      "scenario_id": "hidden_people_manager_span_fresh_001",
      "track": "people",
      "mode": "fresh",
      "hidden_ref": "fresh_008"
    }
  ]
}
