{
  "manifest_version": "0.1.0",
  "benchmark_version": "0.2.0-draft",
  "scenario_pack_version": "strategy-fresh-pack-0.9.0",
  "split": "fresh",
  "scenario_count": 13,
  "scenarios": [
    {
      "scenario_id": "hidden_board_stakeholder_conflict_fresh_001",
      "track": "board",
      "mode": "fresh",
      "hidden_ref": "fresh_000"
    },
    {
      "scenario_id": "hidden_board_financing_truth_fresh_001",
      "track": "board",
      "mode": "fresh",
      "hidden_ref": "fresh_001"
    },
    {
      "scenario_id": "hidden_board_incident_truth_fresh_001",
      "track": "board",
      "mode": "fresh",
      "hidden_ref": "fresh_002"
    },
    {
      "scenario_id": "hidden_product_delayed_consequence_fresh_001",
      "track": "product",
      "mode": "fresh",
      "hidden_ref": "fresh_003"
    },
    {
      "scenario_id": "hidden_scale_multi_quarter_fresh_001",
      "track": "scale",
      "mode": "fresh",
      "hidden_ref": "fresh_004"
    },
    {
      "scenario_id": "hidden_scale_platform_sequence_fresh_001",
      "track": "scale",
      "mode": "fresh",
      "hidden_ref": "fresh_005"
    },
    {
      "scenario_id": "hidden_product_migration_sequence_fresh_001",
      "track": "product",
      "mode": "fresh",
      "hidden_ref": "fresh_006"
    },
    {
      "scenario_id": "hidden_board_product_truth_fresh_001",
      "track": "board",
      "mode": "fresh",
      "hidden_ref": "fresh_007"
    },
    {
      "scenario_id": "hidden_gtm_multi_quarter_sequence_fresh_001",
      "track": "gtm",
      "mode": "fresh",
      "hidden_ref": "fresh_008"
    },
    {
      "scenario_id": "hidden_scale_finance_tradeoff_fresh_001",
      "track": "scale",
      "mode": "fresh",
      "hidden_ref": "fresh_009"
    },
    {
      "scenario_id": "hidden_board_hiring_truth_fresh_001",
      "track": "board",
      "mode": "fresh",
      "hidden_ref": "fresh_010"
    },
    {
      "scenario_id": "hidden_product_platform_tax_fresh_001",
      "track": "product",
      "mode": "fresh",
      "hidden_ref": "fresh_011"
    },
    {
      "scenario_id": "hidden_gtm_efficiency_sequence_fresh_001",
      "track": "gtm",
      "mode": "fresh",
      "hidden_ref": "fresh_012"
    }
  ]
}
