{
  "manifest_version": "0.1.0",
  "benchmark_version": "0.2.0-draft",
  "scenario_pack_version": "real-world-fresh-pack-0.5.0",
  "split": "fresh",
  "scenario_count": 12,
  "scenarios": [
    {
      "scenario_id": "real_world_airbnb_emergency_financing_fresh_001",
      "track": "board",
      "mode": "fresh",
      "hidden_ref": "fresh_000"
    },
    {
      "scenario_id": "real_world_brex_svb_treasury_shock_fresh_001",
      "track": "crisis",
      "mode": "fresh",
      "hidden_ref": "fresh_001"
    },
    {
      "scenario_id": "real_world_buffer_runway_crunch_fresh_001",
      "track": "finance",
      "mode": "fresh",
      "hidden_ref": "fresh_002"
    },
    {
      "scenario_id": "real_world_dropbox_phishing_fresh_001",
      "track": "crisis",
      "mode": "fresh",
      "hidden_ref": "fresh_003"
    },
    {
      "scenario_id": "real_world_github_failover_fresh_001",
      "track": "crisis",
      "mode": "fresh",
      "hidden_ref": "fresh_004"
    },
    {
      "scenario_id": "real_world_zoom_security_freeze_fresh_001",
      "track": "crisis",
      "mode": "fresh",
      "hidden_ref": "fresh_005"
    },
    {
      "scenario_id": "real_world_atlassian_restoration_fresh_001",
      "track": "crisis",
      "mode": "fresh",
      "hidden_ref": "fresh_006"
    },
    {
      "scenario_id": "real_world_shopify_peak_readiness_fresh_001",
      "track": "scale",
      "mode": "fresh",
      "hidden_ref": "fresh_007"
    },
    {
      "scenario_id": "real_world_airbnb_demand_shock_fresh_001",
      "track": "board",
      "mode": "fresh",
      "hidden_ref": "fresh_008"
    },
    {
      "scenario_id": "real_world_robinhood_volatility_outage_fresh_001",
      "track": "crisis",
      "mode": "fresh",
      "hidden_ref": "fresh_009"
    },
    {
      "scenario_id": "real_world_wework_burn_reset_fresh_001",
      "track": "board",
      "mode": "fresh",
      "hidden_ref": "fresh_010"
    },
    {
      "scenario_id": "real_world_instacart_capacity_surge_fresh_001",
      "track": "scale",
      "mode": "fresh",
      "hidden_ref": "fresh_011"
    }
  ]
}
